id,conversation_id,response_hash,response_text,created_at
de3fe4c4-3f8e-4825-8ad6-008b07466d54,77beddde-0adf-4633-a60d-62fa08f082fc,hola marcelo como estas vi que estabas interesado en un citroen estas buscando un 0km o te gustaria ver las opciones de usados certificados que tenemos hoy,"Hola, Marcelo. ¿Cómo estás? Vi que estabas interesado en un Citroën. ¿Estás buscando un 0km o te gustaría ver las opciones de usados certificados que tenemos hoy?",2026-06-16 16:29:28.755444+00
9d9a94fe-ea0b-47e7-8889-e590a641c3b4,77beddde-0adf-4633-a60d-62fa08f082fc,excelente eleccion el confort de citroen es unico tenes en mente algun modelo especifico como el nuevo c3 o la c4 cactus,"Excelente elección. El confort de Citroën es único. ¿Tenés en mente algún modelo específico, como el nuevo C3 o la C4 Cactus?",2026-06-16 16:30:44.083935+00
1d53baf5-7d2f-4856-b73d-d045d17081e8,77beddde-0adf-4633-a60d-62fa08f082fc,el nuevo c3 es ideal para la ciudad por su despeje del suelo y espacio interior te gustaria que agendemos una visita al showroom para que lo veas de cerca y lo pruebes,El nuevo C3 es ideal para la ciudad por su despeje del suelo y espacio interior. ¿Te gustaría que agendemos una visita al showroom para que lo veas de cerca y lo pruebes?,2026-06-16 16:31:34.884284+00
9e284d6f-a07c-43b1-9f27-96e760158733,77beddde-0adf-4633-a60d-62fa08f082fc,claro marcelo te puedo enviar fotos y todos los detalles tecnicos del c3,"Claro, Marcelo. Te puedo enviar fotos y todos los detalles técnicos del C3.",2026-06-16 16:32:38.599759+00
a61efc65-476e-4b50-8eb0-c063338d5105,77beddde-0adf-4633-a60d-62fa08f082fc,te gustaria que coordinemos para manana a las 10 30 o preferis el jueves a las 16 00 en nuestro showroom de mcal lopez,¿Te gustaría que coordinemos para mañana a las 10:30 o preferís el jueves a las 16:00 en nuestro showroom de Mcal. López?,2026-06-16 16:32:46.56548+00
3a61e1ba-191c-46d6-92d9-6b57a5dd64f2,77beddde-0adf-4633-a60d-62fa08f082fc,disculpame marcelo dame un segundo que verifico el catalogo actualizado para enviarte las mejores imagenes,"Disculpame, Marcelo. Dame un segundo que verifico el catálogo actualizado para enviarte las mejores imágenes.",2026-06-16 16:34:41.242645+00
6e8dca9b-7a97-4107-ba31-b6afaf175873,77beddde-0adf-4633-a60d-62fa08f082fc,mientras tanto te queda bien pasar por el showroom manana a las 10 30 o preferis el jueves a las 16 00 para verlo en persona,"Mientras tanto, ¿te queda bien pasar por el showroom mañana a las 10:30 o preferís el jueves a las 16:00 para verlo en persona?",2026-06-16 16:34:49.140962+00
5dd48c7a-525d-444e-8f3b-47ab27c8153d,77beddde-0adf-4633-a60d-62fa08f082fc,beleza voy a te passar pra marcelo sdr automaq que segue de aqui contigo ya te chama em instantes,"Beleza, ! Voy a te passar pra Marcelo — SDR Automaq, que segue de aquí contigo. Ya te chama em instantes.",2026-06-16 16:36:00.021427+00
